{
  "$schema": "https://json-schema.org/draft/2020-12/schema",
  "$id": "https://github.com/kitepon-rgb/Lattice/blob/main/docs/schemas/lattice.todo_witness_set.v4.schema.json",
  "title": "lattice.todo_witness_set.v4",
  "description": "Per-ToDo boundary declaration compiled into a recorded independence judgement (ADR 0127). Each entry declares what the ToDo owns, reads and writes so that pairwise interference can be decided before dispatch. v2 added the optional concern_anchors declaration, which binds seam candidates and never participates in the independence judgement. v3 adds the optional creates marker on an owned path: the ToDo declares that the path does not exist yet and that it will create it (ADR 0136). Unlike concern_anchors, creates does participate in the judgement — it is what makes a not-yet-existing boundary decidable instead of unknown.",
  "$comment": "Runtime validation additionally enforces canonical JSON+LF bytes and the self-digest rule, and delegates manual_witness and sensor_query_set to explainRunRequest so the witness contract is not duplicated (ADR 0123). concern_anchors is stripped before that synthesis, so its non-influence on the judgement is structural rather than asserted. Declaring nothing is not an assertion of independence: an undeclared ToDo compiles to unknown, never to verified. v1 declarations stay valid input and simply cannot carry concern_anchors. creates is carried into the synthesized run request rather than stripped, because the judgement itself needs it; a declared creation is only honoured when the sensor freshly observes the path as absent and reports no affected tests, so the declaration cannot invent structural backing. A misspelled path that was never declared as a creation still fails closed exactly as before. v1 and v2 declarations stay valid input and simply cannot carry creates.",
  "type": "object",
  "additionalProperties": false,
  "required": [
    "schema",
    "project_id",
    "plan_key",
    "capacity",
    "sensor_query_set",
    "manual_witness",
    "witness_set_digest"
  ],
  "properties": {
    "schema": {
      "const": "lattice.todo_witness_set.v4"
    },
    "project_id": {
      "$ref": "#/$defs/identifier"
    },
    "plan_key": {
      "$ref": "#/$defs/identifier"
    },
    "capacity": {
      "type": "object",
      "additionalProperties": false,
      "required": [
        "executors"
      ],
      "properties": {
        "executors": {
          "type": "integer",
          "minimum": 1
        }
      }
    },
    "sensor_query_set": {
      "type": "object",
      "additionalProperties": false,
      "required": [
        "queries"
      ],
      "description": "Sensor queries backing the declarations. Exactly one query must have operation 'status'.",
      "properties": {
        "queries": {
          "type": "array",
          "maxItems": 256,
          "items": {
            "type": "object",
            "additionalProperties": false,
            "required": [
              "id",
              "operation"
            ],
            "properties": {
              "id": {
                "$ref": "#/$defs/identifier"
              },
              "operation": {
                "enum": [
                  "status",
                  "query",
                  "callers",
                  "callees",
                  "impact",
                  "affected"
                ]
              },
              "target": {
                "type": "string",
                "minLength": 1
              }
            }
          }
        }
      }
    },
    "manual_witness": {
      "type": "object",
      "minProperties": 1,
      "maxProperties": 256,
      "description": "Keyed by task_id of the plan. Keys must be a subset of the plan's tasks.",
      "propertyNames": {
        "$ref": "#/$defs/identifier"
      },
      "additionalProperties": {
        "$ref": "#/$defs/witness"
      }
    },
    "witness_set_digest": {
      "$ref": "#/$defs/digest"
    }
  },
  "$defs": {
    "identifier": {
      "type": "string",
      "pattern": "^[0-9A-Za-z][0-9A-Za-z._-]{0,127}$"
    },
    "digest": {
      "type": "string",
      "pattern": "^[0-9a-f]{64}$"
    },
    "repoRelativePath": {
      "type": "string",
      "minLength": 1,
      "maxLength": 1024,
      "description": "Repo-relative path. Absolute paths, backslashes and '..' traversal are rejected. A trailing '/' declares a directory prefix and is accepted only under 'writes'."
    },
    "witness": {
      "type": "object",
      "additionalProperties": false,
      "required": [
        "owns",
        "reads",
        "writes",
        "resources",
        "state_effects",
        "sensor_provenance",
        "affected_tests",
        "unknowns"
      ],
      "properties": {
        "owns": {
          "type": "array",
          "maxItems": 256,
          "description": "Symbols and paths this ToDo claims ownership of. Every entry needs a covering sensor query or it compiles to a sensor_unbound unknown. An entry may additionally declare creates: true for a path this ToDo will bring into existence.",
          "items": {
            "type": "object",
            "additionalProperties": false,
            "required": [
              "kind",
              "target"
            ],
            "properties": {
              "kind": {
                "enum": [
                  "symbol",
                  "path"
                ]
              },
              "target": {
                "type": "string",
                "minLength": 1,
                "maxLength": 1024
              },
              "creates": {
                "const": true,
                "description": "Optional. Declares that this path does not exist yet and that this ToDo creates it. Only valid when kind is path — existence is a filesystem fact and a symbol has none of its own. Only the value true is accepted: false would be a second spelling of an existing path. Omitted is the default."
              }
            }
          }
        },
        "reads": {
          "type": "array",
          "maxItems": 256,
          "items": {
            "$ref": "#/$defs/repoRelativePath"
          }
        },
        "writes": {
          "type": "array",
          "maxItems": 256,
          "items": {
            "$ref": "#/$defs/repoRelativePath"
          }
        },
        "resources": {
          "type": "array",
          "maxItems": 256,
          "description": "Shared resource ids. A resource with no matching state_effect entry is treated as a shared resource of unknown direction and becomes a conflict.",
          "items": {
            "$ref": "#/$defs/identifier"
          }
        },
        "state_effects": {
          "type": "array",
          "maxItems": 256,
          "items": {
            "type": "object",
            "additionalProperties": false,
            "required": [
              "resource_id",
              "kind"
            ],
            "properties": {
              "resource_id": {
                "$ref": "#/$defs/identifier"
              },
              "kind": {
                "enum": [
                  "state",
                  "schema",
                  "invariant",
                  "effect",
                  "external_effect"
                ]
              }
            }
          }
        },
        "sensor_provenance": {
          "type": "object",
          "additionalProperties": false,
          "required": [
            "queries"
          ],
          "properties": {
            "queries": {
              "type": "array",
              "maxItems": 256,
              "items": {
                "type": "object",
                "additionalProperties": false,
                "required": [
                  "query_id",
                  "expect"
                ],
                "properties": {
                  "query_id": {
                    "$ref": "#/$defs/identifier"
                  },
                  "expect": {
                    "oneOf": [
                      {
                        "type": "object",
                        "additionalProperties": false,
                        "required": [
                          "kind",
                          "name",
                          "path"
                        ],
                        "properties": {
                          "kind": {
                            "const": "symbol"
                          },
                          "name": {
                            "type": "string",
                            "minLength": 1
                          },
                          "path": {
                            "$ref": "#/$defs/repoRelativePath"
                          }
                        }
                      },
                      {
                        "type": "object",
                        "additionalProperties": false,
                        "required": [
                          "kind",
                          "path"
                        ],
                        "properties": {
                          "kind": {
                            "enum": [
                              "path",
                              "affected"
                            ]
                          },
                          "path": {
                            "$ref": "#/$defs/repoRelativePath"
                          }
                        }
                      }
                    ]
                  }
                }
              }
            }
          }
        },
        "affected_tests": {
          "type": "array",
          "maxItems": 256,
          "description": "Declared affected tests. Compared exactly against fresh sensor observation; any drift fails the compile rather than being narrowed.",
          "items": {
            "$ref": "#/$defs/repoRelativePath"
          }
        },
        "unknowns": {
          "type": "array",
          "maxItems": 256,
          "description": "Explicitly declared residual unknowns. Recorded, never rounded away.",
          "items": {
            "type": "object",
            "additionalProperties": false,
            "required": [
              "kind",
              "ref"
            ],
            "properties": {
              "kind": {
                "$ref": "#/$defs/identifier"
              },
              "ref": {
                "type": "string",
                "minLength": 1
              }
            }
          }
        },
        "concern_anchors": {
          "type": "array",
          "maxItems": 256,
          "description": "Optional. Which named symbols inside an owned-but-contested resource are this ToDo's concern. Consumed only when binding seam candidates; it can never create, remove or alter a conflict, so a dishonest declaration degrades the proposal without touching the judgement. Declared symbols must resolve through the sensor with an exact name and path match, must live inside the declared resource, and must not overlap another ToDo's declaration for the same resource; any breach yields a typed unknown instead of a proposal.",
          "items": {
            "type": "object",
            "additionalProperties": false,
            "required": [
              "within",
              "symbols"
            ],
            "properties": {
              "within": {
                "type": "object",
                "additionalProperties": false,
                "required": [
                  "kind",
                  "target"
                ],
                "description": "The contested resource. Must be a resource this same ToDo claims under 'owns'.",
                "properties": {
                  "kind": {
                    "enum": [
                      "symbol",
                      "path"
                    ]
                  },
                  "target": {
                    "type": "string",
                    "minLength": 1,
                    "maxLength": 1024
                  }
                }
              },
              "symbols": {
                "type": "array",
                "minItems": 1,
                "maxItems": 256,
                "description": "Symbol names owned by this ToDo inside the resource. Strictly sorted and unique.",
                "items": {
                  "type": "string",
                  "minLength": 1,
                  "maxLength": 1024
                }
              }
            }
          }
        }
      }
    }
  }
}
