{
  "schema": "lattice.todo_witness_set.v4",
  "project_id": "lattice",
  "plan_key": "runtime-prediction-freedom",
  "capacity": {"executors": 1},
  "manual_witness": {
    "rpf-004": {
      "owns": [{"kind": "path", "target": "src/runtime-managed-supervisor.mjs"}],
      "reads": [],
      "writes": ["src/runtime-managed-supervisor.mjs"],
      "affected_tests": [
        "test/integration/aishell-runtime-conflict-dogfood.integration.mjs",
        "test/project-cli.test.mjs",
        "test/runtime-adapter-registry-cli.test.mjs",
        "test/runtime-canonical-write-coverage.test.mjs",
        "test/runtime-conflict-cli.test.mjs",
        "test/runtime-lifecycle-lock.test.mjs",
        "test/runtime-managed-supervisor.test.mjs",
        "test/runtime-scripted-adapter-controller.test.mjs",
        "test/session-context.test.mjs",
        "test/todo-note-gantt.test.mjs"
      ],
      "resources": [],
      "state_effects": [],
      "unknowns": [],
      "sensor_provenance": {
        "queries": [{"query_id": "witness-affected-000", "expect": {"kind": "affected", "path": "src/runtime-managed-supervisor.mjs"}}]
      }
    }
  },
  "sensor_query_set": {
    "queries": [
      {"id": "witness-status", "operation": "status"},
      {"id": "witness-affected-000", "operation": "affected", "target": "src/runtime-managed-supervisor.mjs"}
    ]
  },
  "witness_set_digest": "17bc3bfa7fdb3c7da79b7550ff52b9dad09381491be1582b71b4d19d9bd54133"
}
