{"capacity":{"executors":2},"manual_witness":{"A":{"affected_tests":[],"owns":[{"creates":true,"kind":"path","target":"evidence/scope-split-20260809/live/a.md"}],"reads":[],"resources":[],"sensor_provenance":{"queries":[]},"state_effects":[],"unknowns":[],"writes":["evidence/scope-split-20260809/live/a.md"]},"B":{"affected_tests":[],"owns":[{"creates":true,"kind":"path","target":"evidence/scope-split-20260809/live/b.md"}],"reads":[],"resources":[],"sensor_provenance":{"queries":[]},"state_effects":[],"unknowns":[],"writes":["evidence/scope-split-20260809/live/b.md"]},"C":{"affected_tests":[],"owns":[{"creates":true,"kind":"path","target":"evidence/scope-split-20260809/live/c.md"}],"reads":[],"resources":[],"sensor_provenance":{"queries":[]},"state_effects":[],"unknowns":[],"writes":["evidence/scope-split-20260809/live/c.md"]}},"plan_key":"scope-split-live-20260809","project_id":"lattice","schema":"lattice.todo_witness_set.v4","sensor_query_set":{"queries":[{"id":"witness-status","operation":"status"}]},"witness_set_digest":"ec6b063593bab45f815a1afb86846b017d611ca0d4c0cf3173d15147bd21736a"}
